{
  "$schema": "./schemas/index.schema.json",
  "version": "1.1.0",
  "updated": "2026-10-28T22:58:16.106Z",
  "marketplace": {
    "name": "Polaris Plugin Marketplace",
    "homepage": "https://github.com/misxzaiz/Polaris-plugin",
    "description": "Polaris 插件中心索引。兼容 Polaris installRemotePlugin / checkPluginUpdate 协议。"
  },
  "plugins": [
    {
      "id": "multichat",
      "name": "MultiChat",
      "version": "0.2.0",
      "description": "多设备会话插件：在任意设备（桌面/Web）打开面板即可操作同一组会话——发消息、看实时流式回复、继续对话。复用 cap.ai.chat 现有引擎，不改造现有对话架构。",
      "author": "Polaris",
      "category": "ai",
      "tags": [
        "chat",
        "multi-device",
        "session",
        "panel",
        "streaming"
      ],
      "icon": "Bot",
      "homepage": "https://github.com/misxzaiz/Polaris-plugin/tree/main/plugins/multichat",
      "repository": "https://github.com/misxzaiz/Polaris-plugin",
      "manifestUrl": "https://cdn.jsdelivr.net/gh/misxzaiz/Polaris-plugin@main/plugins/multichat/plugin.json",
      "downloadUrl": "https://cdn.jsdelivr.net/gh/misxzaiz/Polaris-plugin@main/plugins/multichat/multichat.zip",
      "updateUrl": "https://cdn.jsdelivr.net/gh/misxzaiz/Polaris-plugin@main/plugins/multichat/update.json",
      "sha256": "ccb5f578d3cda3b9c95dd401e0209234a2e0ea3fc4d7349486b3ab3c45a47cf2",
      "tier": "beta",
      "permissions": {
        "appConfigRead": true,
        "appConfigWrite": true,
        "aiToolAccess": true
      },
      "screenshots": [],
      "readme": "# MultiChat\n\n多设备会话插件：在任意设备打开面板即可操作同一组会话。Phase 1 = 新建会话 + 继续对话 + 实时流式跨设备广播。不改造现有 AI 对话架构。\n\n- 发消息 → 复用 `cap.ai.chat` 现有引擎\n- 实时流式 → `chat-event` 全员广播（所有在线设备同时收到增量）\n- 续聊 → `continue` 传引擎会话 id，后端权威恢复上下文\n- 会话清单 → `config.json plugins['multichat']`（各端连同一后端天然一致）\n\n> 需主应用提供 `__POLARIS_HOST_LISTEN__`（chat-event 订阅通道）。",
      "versions": [
        {
          "version": "0.2.0",
          "downloadUrl": "https://cdn.jsdelivr.net/gh/misxzaiz/Polaris-plugin@main/plugins/multichat/multichat.zip"
        },
        {
          "version": "0.1.0",
          "downloadUrl": "https://cdn.jsdelivr.net/gh/misxzaiz/Polaris-plugin@main/plugins/multichat/multichat.zip"
        }
      ]
    },
    {
      "id": "polaris.marketplace",
      "name": "Polaris 插件商城",
      "version": "1.2.1",
      "description": "在 Polaris 内浏览、搜索并一键安装本商城索引中的插件；支持查看已装插件、卸载、检查与应用更新，支持选择安装历史版本。提供 ActivityBar 面板与 MCP 工具。",
      "author": "Polaris",
      "category": "productivity",
      "tags": [
        "marketplace",
        "panel",
        "mcp",
        "installer"
      ],
      "icon": "BookOpen",
      "homepage": "https://github.com/misxzaiz/Polaris-plugin/tree/main/plugins/marketplace",
      "repository": "https://github.com/misxzaiz/Polaris-plugin",
      "manifestUrl": "https://cdn.jsdelivr.net/gh/misxzaiz/Polaris-plugin@main/plugins/marketplace/plugin.json",
      "downloadUrl": "https://cdn.jsdelivr.net/gh/misxzaiz/Polaris-plugin@main/plugins/marketplace/marketplace.zip",
      "updateUrl": "https://cdn.jsdelivr.net/gh/misxzaiz/Polaris-plugin@main/plugins/marketplace/update.json",
      "sha256": "315c3b5e9678b555b81386179193bc8e1af08291f1073f154ce34a49ab7f8c51",
      "tier": "production",
      "permissions": {
        "aiToolAccess": true,
        "network": true,
        "appConfigRead": true
      },
      "screenshots": [],
      "readme": "# Polaris 插件商城\n\n在 Polaris 内浏览、搜索并一键安装商城插件，支持卸载与更新。",
      "versions": [
        {
          "version": "1.2.1",
          "downloadUrl": "https://cdn.jsdelivr.net/gh/misxzaiz/Polaris-plugin@main/plugins/marketplace/marketplace.zip",
          "sha256": "315c3b5e9678b555b81386179193bc8e1af08291f1073f154ce34a49ab7f8c51"
        }
      ]
    },
    {
      "id": "relay-devkit",
      "name": "RELAY DevKit",
      "version": "1.5.1",
      "description": "开发者工具箱：API 客户端、JSON 格式化、SQL 工具、数据库管理、时间戳转换。v1.5.1: 修复点击 tab 后 tab 条/侧栏滚动位置跳回开头——重建 DOM 前记录 scrollLeft/scrollTop，渲染后恢复，仅新建 tab 时滚回最左。v1.5.0: 请求超时可配置（默认 120s，含无限制）；发送中手动停止（fetch/代理真实中断，cap.http 逻辑中断）；/__proxy 客户端断开关联修永久挂起",
      "author": "Polaris",
      "category": "dev",
      "tags": [
        "api-client",
        "json",
        "sql",
        "database",
        "dev-tools",
        "panel",
        "service"
      ],
      "icon": "Terminal",
      "homepage": "https://github.com/misxzaiz/Polaris-plugin/tree/main/plugins/relay-devkit",
      "repository": "https://github.com/misxzaiz/Polaris-plugin",
      "manifestUrl": "https://cdn.jsdelivr.net/gh/misxzaiz/Polaris-plugin@main/plugins/relay-devkit/plugin.json",
      "downloadUrl": "https://cdn.jsdelivr.net/gh/misxzaiz/Polaris-plugin@relay-devkit-v1.5.1/plugins/relay-devkit/relay-devkit.zip",
      "updateUrl": "https://cdn.jsdelivr.net/gh/misxzaiz/Polaris-plugin@main/plugins/relay-devkit/update.json",
      "sha256": "b3623d1291229b3eb720362b6e746edd70da1873c1f7af8fc901f4921cf6330a",
      "tier": "production",
      "permissions": {
        "workspaceRead": true,
        "network": true
      },
      "screenshots": [],
      "readme": "# RELAY DevKit\n\n开发者工具箱：API 客户端、JSON 格式化、SQL 工具、数据库管理、时间戳转换。\n\n## 功能\n\n- **API 请求客户端**：多 tab、环境变量、cURL 导入、跨域代理；面板模式宿主 cap.http 直发，携带 Cookie/UA/Referer 等禁发头，免 CORS 限制\n- **JSON 工具**：格式化/压缩/校验/转义，对象树与表格视图\n- **SQL 模板填充**：预编译参数还原，MyBatis 日志解析\n- **时间戳转换**：秒/毫秒/微秒自动识别，双向互转\n- **数据库管理**：MySQL 桥接（经本地后端）+ Supabase REST",
      "versions": [
        {
          "version": "1.5.1",
          "downloadUrl": "https://cdn.jsdelivr.net/gh/misxzaiz/Polaris-plugin@relay-devkit-v1.5.1/plugins/relay-devkit/relay-devkit.zip",
          "sha256": "b3623d1291229b3eb720362b6e746edd70da1873c1f7af8fc901f4921cf6330a"
        },
        {
          "version": "1.5.0",
          "downloadUrl": "https://cdn.jsdelivr.net/gh/misxzaiz/Polaris-plugin@relay-devkit-v1.5.0/plugins/relay-devkit/relay-devkit.zip"
        },
        {
          "version": "1.4.1",
          "downloadUrl": "https://cdn.jsdelivr.net/gh/misxzaiz/Polaris-plugin@relay-devkit-v1.4.1/plugins/relay-devkit/relay-devkit.zip"
        },
        {
          "version": "1.4.0",
          "downloadUrl": "https://cdn.jsdelivr.net/gh/misxzaiz/Polaris-plugin@relay-devkit-v1.4.0/plugins/relay-devkit/relay-devkit.zip"
        },
        {
          "version": "1.3.3",
          "downloadUrl": "https://cdn.jsdelivr.net/gh/misxzaiz/Polaris-plugin@relay-devkit-v1.3.3/plugins/relay-devkit/relay-devkit.zip"
        },
        {
          "version": "1.3.2",
          "downloadUrl": "https://cdn.jsdelivr.net/gh/misxzaiz/Polaris-plugin@relay-devkit-v1.3.2/plugins/relay-devkit/relay-devkit.zip"
        },
        {
          "version": "1.3.0",
          "downloadUrl": "https://cdn.jsdelivr.net/gh/misxzaiz/Polaris-plugin@relay-devkit-v1.3.0/plugins/relay-devkit/relay-devkit.zip"
        },
        {
          "version": "1.2.0",
          "downloadUrl": "https://cdn.jsdelivr.net/gh/misxzaiz/Polaris-plugin@relay-devkit-v1.2.0/plugins/relay-devkit/relay-devkit.zip"
        },
        {
          "version": "1.1.0",
          "downloadUrl": "https://cdn.jsdelivr.net/gh/misxzaiz/Polaris-plugin@v0.2.2/plugins/relay-devkit/relay-devkit.zip"
        }
      ]
    },
    {
      "id": "workspace-manager",
      "name": "工作区管理",
      "version": "0.1.0",
      "description": "工作区管理面板:分组/置顶/图标/备注/搜索高亮/排序切换/批量操作,窗口化虚拟列表支撑 100+ 工作区。所有变更委托主应用 workspaceStore,主应用工作区绑定自动同步。",
      "author": "Polaris",
      "category": "productivity",
      "tags": [
        "workspace",
        "manager",
        "panel",
        "grouping",
        "pin",
        "search"
      ],
      "icon": "CheckSquare",
      "homepage": "https://github.com/misxzaiz/Polaris-plugin/tree/main/plugins/workspace-manager",
      "repository": "https://github.com/misxzaiz/Polaris-plugin",
      "manifestUrl": "https://cdn.jsdelivr.net/gh/misxzaiz/Polaris-plugin@main/plugins/workspace-manager/plugin.json",
      "downloadUrl": "https://cdn.jsdelivr.net/gh/misxzaiz/Polaris-plugin@main/plugins/workspace-manager/workspace-manager.zip",
      "updateUrl": "https://cdn.jsdelivr.net/gh/misxzaiz/Polaris-plugin@main/plugins/workspace-manager/update.json",
      "sha256": "fe9e7b52a521f45f9f2646c6817ae5b1d28e5d5a2dbc329ac31ea03876509af9",
      "tier": "beta",
      "permissions": {
        "workspaceRead": true,
        "workspaceWrite": true,
        "appConfigRead": true,
        "appConfigWrite": true
      },
      "screenshots": [],
      "readme": "# 工作区管理\n\n工作区数量增长后,下拉切换不再够用。本插件提供完整管理面板:\n\n- **组织**:分组/置顶/图标/备注\n- **检索**:搜索(名称/路径/备注)+高亮,排序切换\n- **规模**:窗口化虚拟列表,100+ 工作区流畅滚动\n- **批量**:多选删除/移入分组;导入导出 JSON 备份\n- **同步**:所有变更委托主应用 workspaceStore,主应用工作区绑定自动更新\n\n## 使用\n\n安装后 ActivityBar 出现\"工作区管理\"图标,或从顶部工作区下拉底部\"管理工作区\"进入。\n\n> 需主应用提供 __POLARIS_WORKSPACE_API__ 宿主支持。",
      "versions": [
        {
          "version": "0.1.0",
          "downloadUrl": "https://cdn.jsdelivr.net/gh/misxzaiz/Polaris-plugin@main/plugins/workspace-manager/workspace-manager.zip",
          "sha256": "fe9e7b52a521f45f9f2646c6817ae5b1d28e5d5a2dbc329ac31ea03876509af9"
        }
      ]
    },
    {
      "id": "image-recognition",
      "name": "图片识别",
      "version": "0.1.5",
      "description": "智谱 GLM-4V 视觉模型图片识别 MCP 插件。提供 AI 图片识别工具（单张/批量/目录），支持本地图片（base64）和 URL 输入。含 API Key 配置与测试面板。v0.1.5：面板 API 调用改道宿主 cap.http 转发，面板/Web/移动端跨域访问智谱 API 不再被 CORS 拦截（含测试连接）。v0.1.4：maxTokens 默认提至 4000（下限 1000），长文/多图分析结果不再被腰斩截断；商城补充演示截图。v0.1.3：新增 recognize_image_dir 批量识图 + images 多图数组。",
      "author": "Polaris",
      "category": "ai",
      "tags": [
        "image",
        "vision",
        "glm",
        "mcp",
        "panel"
      ],
      "icon": "Activity",
      "homepage": "https://github.com/misxzaiz/Polaris-plugin/tree/main/plugins/image-recognition",
      "repository": "https://github.com/misxzaiz/Polaris-plugin",
      "manifestUrl": "https://cdn.jsdelivr.net/gh/misxzaiz/Polaris-plugin@main/plugins/image-recognition/plugin.json",